{
  "schema_version": "data-contract/1.0.0",
  "data_version": "synthetic-base/1.0.0",
  "fixture_id": "FIXTURE-CANDIDATE-ACTIONS",
  "provenance": {
    "mode": "SYNTHETIC",
    "created_by": "NourishOps build-context team",
    "description": "Closed catalog of synthetic actions. The agent may never create an action outside these records."
  },
  "records": [
    {"action_id":"ACT-A-PURCHASE-PROTEIN-15000","scenario_id":"SCN-A-USDA-PROTEIN-DELAY","display_name":"Purchase 15,000 lb of protein","action_type":"PURCHASE","category_id":"PROTEIN","subject_record_id":"QUOTE-A-PROTEIN-STANDARD","requested_quantity_lb":15000,"minimum_quantity_lb":5000,"maximum_quantity_lb":20000,"quantity_increment_lb":1000,"unit_price_usd_per_lb":0.85,"fixed_cost_usd":0.00,"computed_cost_usd":12750.00,"lead_time_days":7,"arrival_week_start":"2026-08-10","success_probability":1.0,"expected_usable_yield_ratio":1.0,"usable_life_days":60,"storage_type":"FROZEN","operational_burden":"MEDIUM","synthetic_destination_id":"WH-CENTRAL-01","requires_human_approval":true,"evidence_ids":["EVD-A-VENDOR-STANDARD"],"record_version":1,"provenance_id":"PROV-SYNTHETIC-ACTION-CATALOG"},
    {"action_id":"ACT-A-TRANSFER-PROTEIN-8000","scenario_id":"SCN-A-USDA-PROTEIN-DELAY","display_name":"Request fixed 8,000 lb peer transfer","action_type":"REQUEST_TRANSFER","category_id":"PROTEIN","subject_record_id":"PEER-OFFER-A-PROTEIN-8000","requested_quantity_lb":8000,"minimum_quantity_lb":8000,"maximum_quantity_lb":8000,"quantity_increment_lb":1000,"unit_price_usd_per_lb":null,"fixed_cost_usd":600.00,"computed_cost_usd":600.00,"lead_time_days":5,"arrival_week_start":"2026-08-10","success_probability":1.0,"expected_usable_yield_ratio":1.0,"usable_life_days":45,"storage_type":"FROZEN","operational_burden":"MEDIUM","synthetic_destination_id":"WH-CENTRAL-01","requires_human_approval":true,"evidence_ids":["EVD-A-PEER-TRANSFER"],"record_version":1,"provenance_id":"PROV-SYNTHETIC-ACTION-CATALOG"},
    {"action_id":"ACT-A-DONOR-REQUEST-PROTEIN-15000","scenario_id":"SCN-A-USDA-PROTEIN-DELAY","display_name":"Request 15,000 lb from targeted donors","action_type":"TARGETED_DONOR_REQUEST","category_id":"PROTEIN","subject_record_id":null,"requested_quantity_lb":15000,"minimum_quantity_lb":5000,"maximum_quantity_lb":15000,"quantity_increment_lb":1000,"unit_price_usd_per_lb":null,"fixed_cost_usd":0.00,"computed_cost_usd":0.00,"lead_time_days":6,"arrival_week_start":"2026-08-10","success_probability":0.45,"expected_usable_yield_ratio":1.0,"usable_life_days":60,"storage_type":"FROZEN","operational_burden":"HIGH","synthetic_destination_id":"WH-CENTRAL-01","requires_human_approval":true,"evidence_ids":["EVD-A-DONOR-ASSUMPTION"],"record_version":1,"provenance_id":"PROV-SYNTHETIC-ACTION-CATALOG"},
    {"action_id":"ACT-A-MONITOR","scenario_id":"SCN-A-USDA-PROTEIN-DELAY","display_name":"Monitor without intervention","action_type":"MONITOR","category_id":"PROTEIN","subject_record_id":"INB-USDA-PROTEIN-104","requested_quantity_lb":0,"minimum_quantity_lb":0,"maximum_quantity_lb":0,"quantity_increment_lb":1,"unit_price_usd_per_lb":null,"fixed_cost_usd":0.00,"computed_cost_usd":0.00,"lead_time_days":0,"arrival_week_start":null,"success_probability":1.0,"expected_usable_yield_ratio":0.0,"usable_life_days":null,"storage_type":"NONE","operational_burden":"LOW","synthetic_destination_id":null,"requires_human_approval":true,"evidence_ids":["EVD-A-USDA-DELAY-NOTICE"],"record_version":1,"provenance_id":"PROV-SYNTHETIC-ACTION-CATALOG"},
    {"action_id":"ACT-A-PURCHASE-PROTEIN-25000","scenario_id":"SCN-A-USDA-PROTEIN-DELAY","display_name":"Purchase oversized 25,000 lb lot","action_type":"PURCHASE","category_id":"PROTEIN","subject_record_id":"QUOTE-A-PROTEIN-OVERSIZED","requested_quantity_lb":25000,"minimum_quantity_lb":25000,"maximum_quantity_lb":25000,"quantity_increment_lb":1000,"unit_price_usd_per_lb":0.85,"fixed_cost_usd":0.00,"computed_cost_usd":21250.00,"lead_time_days":7,"arrival_week_start":"2026-08-10","success_probability":1.0,"expected_usable_yield_ratio":1.0,"usable_life_days":60,"storage_type":"FROZEN","operational_burden":"MEDIUM","synthetic_destination_id":"WH-CENTRAL-01","requires_human_approval":true,"evidence_ids":["EVD-A-VENDOR-OVERSIZED"],"record_version":1,"provenance_id":"PROV-SYNTHETIC-ACTION-CATALOG"},
    {"action_id":"ACT-A-PURCHASE-PROTEIN-LATE-15000","scenario_id":"SCN-A-USDA-PROTEIN-DELAY","display_name":"Purchase lower-cost protein with two-week lead","action_type":"PURCHASE","category_id":"PROTEIN","subject_record_id":"QUOTE-A-PROTEIN-LATE","requested_quantity_lb":15000,"minimum_quantity_lb":5000,"maximum_quantity_lb":15000,"quantity_increment_lb":1000,"unit_price_usd_per_lb":0.80,"fixed_cost_usd":0.00,"computed_cost_usd":12000.00,"lead_time_days":14,"arrival_week_start":"2026-08-17","success_probability":1.0,"expected_usable_yield_ratio":1.0,"usable_life_days":60,"storage_type":"FROZEN","operational_burden":"LOW","synthetic_destination_id":"WH-CENTRAL-01","requires_human_approval":true,"evidence_ids":["EVD-A-VENDOR-LATE"],"record_version":1,"provenance_id":"PROV-SYNTHETIC-ACTION-CATALOG"},

    {"action_id":"ACT-B-PARTIAL-PRODUCE-10000","scenario_id":"SCN-B-SHORT-LIFE-PRODUCE","display_name":"Accept 10,000 lb of the produce offer","action_type":"PARTIAL_ACCEPT","category_id":"PRODUCE","subject_record_id":"OFFER-B-PRODUCE-20000","requested_quantity_lb":10000,"minimum_quantity_lb":1000,"maximum_quantity_lb":20000,"quantity_increment_lb":1000,"unit_price_usd_per_lb":null,"fixed_cost_usd":0.00,"computed_cost_usd":0.00,"lead_time_days":0,"arrival_week_start":"2026-08-03","success_probability":1.0,"expected_usable_yield_ratio":1.0,"usable_life_days":5,"storage_type":"REFRIGERATED","operational_burden":"MEDIUM","synthetic_destination_id":"WH-CENTRAL-01","requires_human_approval":true,"evidence_ids":["EVD-B-PRODUCE-OFFER"],"record_version":1,"provenance_id":"PROV-SYNTHETIC-ACTION-CATALOG"},
    {"action_id":"ACT-B-ACCEPT-PRODUCE-20000","scenario_id":"SCN-B-SHORT-LIFE-PRODUCE","display_name":"Accept the full 20,000 lb produce offer","action_type":"ACCEPT_DONATION","category_id":"PRODUCE","subject_record_id":"OFFER-B-PRODUCE-20000","requested_quantity_lb":20000,"minimum_quantity_lb":20000,"maximum_quantity_lb":20000,"quantity_increment_lb":1000,"unit_price_usd_per_lb":null,"fixed_cost_usd":0.00,"computed_cost_usd":0.00,"lead_time_days":0,"arrival_week_start":"2026-08-03","success_probability":1.0,"expected_usable_yield_ratio":1.0,"usable_life_days":5,"storage_type":"REFRIGERATED","operational_burden":"HIGH","synthetic_destination_id":"WH-CENTRAL-01","requires_human_approval":true,"evidence_ids":["EVD-B-PRODUCE-OFFER"],"record_version":1,"provenance_id":"PROV-SYNTHETIC-ACTION-CATALOG"},
    {"action_id":"ACT-B-REDIRECT-PRODUCE-20000","scenario_id":"SCN-B-SHORT-LIFE-PRODUCE","display_name":"Request redirect of the full produce offer","action_type":"REDIRECT_DONATION","category_id":"PRODUCE","subject_record_id":"OFFER-B-PRODUCE-20000","requested_quantity_lb":20000,"minimum_quantity_lb":20000,"maximum_quantity_lb":20000,"quantity_increment_lb":1000,"unit_price_usd_per_lb":null,"fixed_cost_usd":400.00,"computed_cost_usd":400.00,"lead_time_days":0,"arrival_week_start":null,"success_probability":1.0,"expected_usable_yield_ratio":1.0,"usable_life_days":5,"storage_type":"NONE","operational_burden":"MEDIUM","synthetic_destination_id":"SYNTH-PEER-EAST","requires_human_approval":true,"evidence_ids":["EVD-B-PEER-REDIRECT"],"record_version":1,"provenance_id":"PROV-SYNTHETIC-ACTION-CATALOG"},
    {"action_id":"ACT-B-DECLINE-PRODUCE-20000","scenario_id":"SCN-B-SHORT-LIFE-PRODUCE","display_name":"Decline the produce offer","action_type":"DECLINE_DONATION","category_id":"PRODUCE","subject_record_id":"OFFER-B-PRODUCE-20000","requested_quantity_lb":20000,"minimum_quantity_lb":20000,"maximum_quantity_lb":20000,"quantity_increment_lb":1000,"unit_price_usd_per_lb":null,"fixed_cost_usd":0.00,"computed_cost_usd":0.00,"lead_time_days":0,"arrival_week_start":null,"success_probability":1.0,"expected_usable_yield_ratio":0.0,"usable_life_days":5,"storage_type":"NONE","operational_burden":"LOW","synthetic_destination_id":null,"requires_human_approval":true,"evidence_ids":["EVD-B-PRODUCE-OFFER"],"record_version":1,"provenance_id":"PROV-SYNTHETIC-ACTION-CATALOG"},
    {"action_id":"ACT-B-PURCHASE-PRODUCE-LATE-10000","scenario_id":"SCN-B-SHORT-LIFE-PRODUCE","display_name":"Purchase 10,000 lb of produce next week","action_type":"PURCHASE","category_id":"PRODUCE","subject_record_id":"QUOTE-B-PRODUCE-LATE","requested_quantity_lb":10000,"minimum_quantity_lb":5000,"maximum_quantity_lb":10000,"quantity_increment_lb":1000,"unit_price_usd_per_lb":1.20,"fixed_cost_usd":0.00,"computed_cost_usd":12000.00,"lead_time_days":7,"arrival_week_start":"2026-08-10","success_probability":1.0,"expected_usable_yield_ratio":1.0,"usable_life_days":7,"storage_type":"REFRIGERATED","operational_burden":"MEDIUM","synthetic_destination_id":"WH-CENTRAL-01","requires_human_approval":true,"evidence_ids":["EVD-B-VENDOR-LATE"],"record_version":1,"provenance_id":"PROV-SYNTHETIC-ACTION-CATALOG"},
    {"action_id":"ACT-B-MONITOR","scenario_id":"SCN-B-SHORT-LIFE-PRODUCE","display_name":"Monitor without accepting the offer","action_type":"MONITOR","category_id":"PRODUCE","subject_record_id":"OFFER-B-PRODUCE-20000","requested_quantity_lb":0,"minimum_quantity_lb":0,"maximum_quantity_lb":0,"quantity_increment_lb":1,"unit_price_usd_per_lb":null,"fixed_cost_usd":0.00,"computed_cost_usd":0.00,"lead_time_days":0,"arrival_week_start":null,"success_probability":1.0,"expected_usable_yield_ratio":0.0,"usable_life_days":null,"storage_type":"NONE","operational_burden":"LOW","synthetic_destination_id":null,"requires_human_approval":true,"evidence_ids":["EVD-B-PRODUCE-OFFER"],"record_version":1,"provenance_id":"PROV-SYNTHETIC-ACTION-CATALOG"},